title,price,rating,reviews,availability
"GIGABYTE GeForce RTX 4070 Eagle OC 12G Graphics Card, 3X WINDFORCE Fans, 12GB 192-bit GDDR6X, GV-N4070EAGLE OC-12GD Video Card",,4.7 out of 5 stars,43 ratings,
"ASUS Dual GeForce® RTX 4070 OC Edition 12GB GDDR6X, IP5X, Auto-Extreme Technology, 144-Hour Validation Program, HDMI 2.1a, DP 1.4a",,4.7 out of 5 stars,350 ratings,
"ZOTAC Gaming GeForce RTX 4070 Twin Edge OC White Edition DLSS 3 12GB GDDR6X 192-bit 21 Gbps PCIE 4.0 Compact Gaming Graphics Card, IceStorm 2.0 Advanced Cooling, Spectra RGB Lighting, ZT-D40700Q-10M",,Previous page of related Sponsored Products,,
"ZOTAC Gaming GeForce RTX 4070 Twin Edge OC DLSS 3 12GB GDDR6X 192-bit 21 Gbps PCIE 4.0 Compact Gaming Graphics Card, IceStorm 2.0 Advanced Cooling, Spectra RGB Lighting, ZT-D40700H-10M",,4.5 out of 5 stars,21 ratings,
"ASUS TUF Gaming NVIDIA GeForce RTX™ 4070 OC Edition Gaming Graphics Card (PCIe 4.0, 12GB GDDR6X, HDMI 2.1, DisplayPort 1.4a)",,4.7 out of 5 stars,259 ratings,
"GIGABYTE GeForce RTX 4070 Gaming OC 12G Graphics Card, 3X WINDFORCE Fans, 12GB 192-bit GDDR6X, GV-N4070GAMING OC-12GD Video Card",,4.3 out of 5 stars,49 ratings,
MSI Gaming GeForce RTX 4070 12GB GDRR6X 192-Bit HDMI/DP Nvlink TORX Fan 4.0 Ada Lovelace Architecture Graphics Card (RTX 4070 Ventus 3X 12G OC),,4.7 out of 5 stars,152 ratings,
"GIGABYTE GeForce RTX 4070 AERO OC 12G Graphics Card, 3X WINDFORCE Fans, 12GB 192-bit GDDR6X, GV-N4070AERO OC-12GD Video Card",,4.6 out of 5 stars,70 ratings,In Stock
"GIGABYTE GeForce RTX 4070 WINDFORCE OC 12G Graphics Card, 3X WINDFORCE Fans, 12GB 192-bit GDDR6X, GV-N4070WF3OC-12GD Video Card",,4.7 out of 5 stars,97 ratings,Not Available
"ASUS ROG Strix NVIDIA GeForce RTX™ 4070 Ti OC Edition Gaming Graphics Card (PCIe 4.0, 12GB GDDR6X, HDMI 2.1a, DisplayPort 1.4a)",,4.6 out of 5 stars,95 ratings,In Stock
MSI Gaming GeForce RTX 4070 Ti 12GB GDRR6X 192-Bit HDMI/DP Nvlink Tri-Frozr 3 Ada Lovelace Architecture Graphics Card (RTX 4070 Ti Gaming X Slim 12G),,5.0 out of 5 stars,5 ratings,In Stock
"YEYIAN Yari ARGB Desktop Computer PC, Intel Core i7 12700F up to 4.9GHz, GeForce RTX 4070 Ti 12GB Graphic Card, 16G RAM DDR4 3200Mhz, 1TB NVMe SSD,850 Gold Certified Power Supply,WiFi & Win 11 Home",,3.9 out of 5 stars,17 ratings,Only 10 left in stock - order soon.
ZOTAC Gaming GeForce RTX 4070 Ti AMP AIRO Spider-Man: Across The Spider-Verse Inspired Graphics Card Bundle - ZT-D40710F-10SMP,,4.6 out of 5 stars,40 ratings,In Stock
"ZOTAC Gaming GeForce RTX 4070 Ti Trinity OC DLSS 3 12GB GDDR6X 192-bit 21 Gbps PCIE 4.0 Gaming Graphics Card, IceStorm 2.0 Advanced Cooling, Spectra 2.0 RGB Lighting, ZT-D40710J-10P",,4.7 out of 5 stars,229 ratings,
"GIGABYTE GeForce RTX 4070 Ti WINDFORCE OC 12G Graphics Card, 3X WINDFORCE Fans, 12GB 192-bit GDDR6X, GV-N407TWF3OC-12GD Video Card",,4.2 out of 5 stars,19 ratings,
"ZOTAC Gaming GeForce RTX 4070 Ti Trinity OC White Edition DLSS 3 12GB GDDR6X 192-bit 21 Gbps PCIE 4.0 Gaming Graphics Card, IceStorm 2.0 Advanced Cooling, Spectra 2.0 RGB Lighting, ZT-D40710Q-10P",,Previous page of related Sponsored Products,,
"YEYIAN Shoge Gaming Computer PC - Ryzen 5 7600X 5.30 GHz, GeForce RTX 4070 12GB, 1TB NVMe SSD, 16GB DDR5 5600MHz, Prebuilt Desktop PC with Liquid Cooler, 650W Gold PSU, Win 11 Home, VR Ready",,4.7 out of 5 stars,10 ratings,Only 2 left in stock - order soon.
"ASUS ROG Strix G16 (2023) Gaming Laptop, 16” Nebula Display 16:10 QHD 240Hz, GeForce RTX 4070, Intel Core i9-13980HX, 32GB DDR5, 1TB PCIe SSD, Wi-Fi 6E, Windows 11 Pro, G614JI-XS96,Eclipse Gray",,4.2 out of 5 stars,80 ratings,In Stock
"Skytech Gaming Prism Gaming PC, Intel i9 13900K 3.0 GHz, RTX 4070 Ti, 1TB NVME Gen4, 32GB DDR5 RAM RGB, 850W Gold PSU Wi-Fi, Win 11 Home, RGB-Keyboard and RGB-Mouse Included",,4.4 out of 5 stars,45 ratings,Only 1 left in stock (more on the way).
"YEYIAN Odachi VR Gaming PC, AMD Ryzen 7 7800X3D 5.0 GHz, GeForce RTX 4070 12GB, 16GB DDR5 5600Mhz,1TB NVME SSD, 750W Gold PSU, WiFi & Win 11 Home",,3.9 out of 5 stars,880 ratings,
"Skytech Gaming Chronos Gaming PC, Intel i9 12900K 3.2 GHz, RTX 4070, 1TB NVME, 32GB DDR5 RAM RGB, 750W Gold PSU Wi-Fi, Win 11 Home, RGB-Keyboard and RGB-Mouse Included",,4.0 out of 5 stars,9 ratings,Only 6 left in stock (more on the way).
